[
  {
    "id": "agame",
    "name": "AGAME",
    "repo_url": "https://github.com/Arrow-Head-Tech/AGAME",
    "phase": "idea",
    "primary_language": "HTML",
    "primary_stack": "HTML",
    "tags": [],
    "short_description": "Agame - JavaScript/Node.js project",
    "owner": "Arrow-Head-Tech",
    "last_updated": "2025-10-30"
  },
  {
    "id": "anotherescaperoomgame",
    "name": "AnotherEscapeRoomGame",
    "repo_url": "https://github.com/Arrow-Head-Tech/AnotherEscapeRoomGame",
    "phase": "idea",
    "primary_language": "HTML",
    "primary_stack": "HTML",
    "tags": [],
    "short_description": "A browser-based text adventure escape room game built with HTML/JavaScript. An exploration of interactive storytelling.",
    "owner": "Arrow-Head-Tech",
    "last_updated": "2025-10-30"
  },
  {
    "id": "arqiv",
    "name": "Arqiv",
    "repo_url": "https://github.com/Arrow-Head-Tech/Arqiv",
    "phase": "idea",
    "primary_language": "Python",
    "primary_stack": "Python",
    "tags": [],
    "short_description": "A personal archive management system for tracking books, films, and places visited with API integration.",
    "owner": "Arrow-Head-Tech",
    "last_updated": "2025-10-30"
  },
  {
    "id": "bain-metis",
    "name": "Bain-Metis",
    "repo_url": "https://github.com/Arrow-Head-Tech/Bain-Metis",
    "phase": "idea",
    "primary_language": "Python",
    "primary_stack": "Python",
    "tags": [],
    "short_description": "Automatic Data Comparison from Tableau API",
    "owner": "Arrow-Head-Tech",
    "last_updated": "2025-11-04"
  },
  {
    "id": "balcony",
    "name": "BALCONY",
    "repo_url": "https://github.com/Arrow-Head-Tech/BALCONY",
    "phase": "idea",
    "primary_language": "HTML",
    "primary_stack": "HTML",
    "tags": [],
    "short_description": "Simple Project's Balcony",
    "owner": "Arrow-Head-Tech",
    "last_updated": "2025-10-30"
  },
  {
    "id": "banking-game",
    "name": "BANKING_GAME",
    "repo_url": "https://github.com/Arrow-Head-Tech/BANKING_GAME",
    "phase": "dev",
    "primary_language": "HTML",
    "primary_stack": "HTML",
    "tags": [],
    "short_description": "Banking Game - JavaScript/Node.js project",
    "owner": "Arrow-Head-Tech",
    "last_updated": "2025-10-30"
  },
  {
    "id": "bash-as-a-service",
    "name": "BASH-AS-A-SERVICE",
    "repo_url": "https://github.com/Arrow-Head-Tech/BASH-AS-A-SERVICE",
    "phase": "idea",
    "primary_language": "CSS",
    "primary_stack": "CSS",
    "tags": [],
    "short_description": "A boilerplate from html template",
    "owner": "Arrow-Head-Tech",
    "last_updated": "2025-10-30"
  },
  {
    "id": "bugsbunnyserver",
    "name": "BUGSBUNNYSERVER",
    "repo_url": "https://github.com/Arrow-Head-Tech/BUGSBUNNYSERVER",
    "phase": "idea",
    "primary_language": "Python",
    "primary_stack": "Python",
    "tags": [],
    "short_description": "Bugsbunnyserver - Python project",
    "owner": "Arrow-Head-Tech",
    "last_updated": "2025-10-30"
  },
  {
    "id": "care-tracker-ai-88",
    "name": "care-tracker-ai-88",
    "repo_url": "https://github.com/Arrow-Head-Tech/care-tracker-ai-88",
    "phase": "idea",
    "primary_language": "TypeScript",
    "primary_stack": "TypeScript",
    "tags": [],
    "short_description": "TBD",
    "owner": "Arrow-Head-Tech",
    "last_updated": "2025-07-27"
  },
  {
    "id": "checkpoint",
    "name": "CHECKPOINT",
    "repo_url": "https://github.com/Arrow-Head-Tech/CHECKPOINT",
    "phase": "idea",
    "primary_language": "JavaScript",
    "primary_stack": "JavaScript",
    "tags": [],
    "short_description": "Checkpoint - JavaScript/Node.js project",
    "owner": "Arrow-Head-Tech",
    "last_updated": "2025-10-30"
  },
  {
    "id": "code-screener",
    "name": "CODE_SCREENER",
    "repo_url": "https://github.com/Arrow-Head-Tech/CODE_SCREENER",
    "phase": "idea",
    "primary_language": "HTML",
    "primary_stack": "HTML",
    "tags": [],
    "short_description": "A tool for screening and analyzing code quality and patterns using SQL queries and web interface.",
    "owner": "Arrow-Head-Tech",
    "last_updated": "2025-10-30"
  },
  {
    "id": "comm",
    "name": "comm",
    "repo_url": "https://github.com/Arrow-Head-Tech/comm",
    "phase": "idea",
    "primary_language": "Unknown",
    "primary_stack": "Unknown",
    "tags": [],
    "short_description": "Communication framework.",
    "owner": "Arrow-Head-Tech",
    "last_updated": "2025-10-30"
  },
  {
    "id": "comm-bots",
    "name": "comm-bots",
    "repo_url": "https://github.com/Arrow-Head-Tech/comm-bots",
    "phase": "idea",
    "primary_language": "TypeScript",
    "primary_stack": "TypeScript",
    "tags": [],
    "short_description": "Communication bots system.",
    "owner": "Arrow-Head-Tech",
    "last_updated": "2025-10-30"
  },
  {
    "id": "comm-gateway",
    "name": "comm-gateway",
    "repo_url": "https://github.com/Arrow-Head-Tech/comm-gateway",
    "phase": "idea",
    "primary_language": "TypeScript",
    "primary_stack": "TypeScript",
    "tags": [],
    "short_description": "TBD",
    "owner": "Arrow-Head-Tech",
    "last_updated": "2025-08-29"
  },
  {
    "id": "comm-sdk",
    "name": "comm-sdk",
    "repo_url": "https://github.com/Arrow-Head-Tech/comm-sdk",
    "phase": "idea",
    "primary_language": "TypeScript",
    "primary_stack": "TypeScript",
    "tags": [],
    "short_description": "TBD",
    "owner": "Arrow-Head-Tech",
    "last_updated": "2025-08-29"
  },
  {
    "id": "comm-types",
    "name": "comm-types",
    "repo_url": "https://github.com/Arrow-Head-Tech/comm-types",
    "phase": "idea",
    "primary_language": "TypeScript",
    "primary_stack": "TypeScript",
    "tags": [],
    "short_description": "TBD",
    "owner": "Arrow-Head-Tech",
    "last_updated": "2025-08-29"
  },
  {
    "id": "competitive-programming",
    "name": "COMPETITIVE_PROGRAMMING",
    "repo_url": "https://github.com/Arrow-Head-Tech/COMPETITIVE_PROGRAMMING",
    "phase": "idea",
    "primary_language": "C",
    "primary_stack": "C",
    "tags": [],
    "short_description": "TBD",
    "owner": "Arrow-Head-Tech",
    "last_updated": "2025-12-08"
  },
  {
    "id": "cptm-qrcode-generator-blue-pen",
    "name": "CPTM_QRCODE_GENERATOR_BLUE_PEN",
    "repo_url": "https://github.com/Arrow-Head-Tech/CPTM_QRCODE_GENERATOR_BLUE_PEN",
    "phase": "idea",
    "primary_language": "Python",
    "primary_stack": "Python",
    "tags": [],
    "short_description": "A specialized QR code generator for CPTM (São Paulo Metropolitan Train Company) integration.",
    "owner": "Arrow-Head-Tech",
    "last_updated": "2025-10-30"
  },
  {
    "id": "crawlers",
    "name": "CRAWLERS",
    "repo_url": "https://github.com/Arrow-Head-Tech/CRAWLERS",
    "phase": "dev",
    "primary_language": "HTML",
    "primary_stack": "HTML",
    "tags": [],
    "short_description": "Crawlers - Python project",
    "owner": "Arrow-Head-Tech",
    "last_updated": "2025-10-30"
  },
  {
    "id": "ctflor",
    "name": "CTFlor",
    "repo_url": "https://github.com/Arrow-Head-Tech/CTFlor",
    "phase": "idea",
    "primary_language": "PHP",
    "primary_stack": "PHP",
    "tags": [],
    "short_description": "TBD",
    "owner": "Arrow-Head-Tech",
    "last_updated": "2025-06-30"
  },
  {
    "id": "data-insight-hub",
    "name": "data-insight-hub",
    "repo_url": "https://github.com/Arrow-Head-Tech/data-insight-hub",
    "phase": "idea",
    "primary_language": "TypeScript",
    "primary_stack": "TypeScript",
    "tags": [],
    "short_description": "TBD",
    "owner": "Arrow-Head-Tech",
    "last_updated": "2026-01-21"
  },
  {
    "id": "decoracao-github-io",
    "name": "decoracao.github.io",
    "repo_url": "https://github.com/Arrow-Head-Tech/decoracao.github.io",
    "phase": "idea",
    "primary_language": "HTML",
    "primary_stack": "HTML",
    "tags": [],
    "short_description": "Home of DeCoracao",
    "owner": "Arrow-Head-Tech",
    "last_updated": "2025-06-30"
  },
  {
    "id": "delivery2",
    "name": "DELIVERY2",
    "repo_url": "https://github.com/Arrow-Head-Tech/DELIVERY2",
    "phase": "dev",
    "primary_language": "PHP",
    "primary_stack": "PHP",
    "tags": [],
    "short_description": "Delivery2 - JavaScript/Node.js project",
    "owner": "Arrow-Head-Tech",
    "last_updated": "2025-10-30"
  },
  {
    "id": "diego",
    "name": "DIEGO",
    "repo_url": "https://github.com/Arrow-Head-Tech/DIEGO",
    "phase": "idea",
    "primary_language": "Python",
    "primary_stack": "Python",
    "tags": [],
    "short_description": "Diego - Python project",
    "owner": "Arrow-Head-Tech",
    "last_updated": "2025-10-30"
  },
  {
    "id": "dietmd",
    "name": "DIETMD",
    "repo_url": "https://github.com/Arrow-Head-Tech/DIETMD",
    "phase": "idea",
    "primary_language": "Unknown",
    "primary_stack": "Unknown",
    "tags": [],
    "short_description": "Dietmd - Software development project",
    "owner": "Arrow-Head-Tech",
    "last_updated": "2025-10-30"
  },
  {
    "id": "drspotter",
    "name": "DRSPOTTER",
    "repo_url": "https://github.com/Arrow-Head-Tech/DRSPOTTER",
    "phase": "idea",
    "primary_language": "JavaScript",
    "primary_stack": "JavaScript",
    "tags": [],
    "short_description": "Drspotter - JavaScript/Node.js project",
    "owner": "Arrow-Head-Tech",
    "last_updated": "2025-10-30"
  },
  {
    "id": "estatistica-comp-resolucao",
    "name": "ESTATISTICA-COMP-RESOLUCAO",
    "repo_url": "https://github.com/Arrow-Head-Tech/ESTATISTICA-COMP-RESOLUCAO",
    "phase": "idea",
    "primary_language": "Jupyter Notebook",
    "primary_stack": "Jupyter Notebook",
    "tags": [],
    "short_description": "Estatistica Comp Resolucao - Software development project",
    "owner": "Arrow-Head-Tech",
    "last_updated": "2025-10-30"
  },
  {
    "id": "garticplayer",
    "name": "GARTICPLAYER",
    "repo_url": "https://github.com/Arrow-Head-Tech/GARTICPLAYER",
    "phase": "idea",